title,authors,year,venue,doi,url
TransPixeler: Advancing Text-to-Video Generation with Transparency,"Luozhou Wang, Yijun Li, Zhifei Chen, Jui-Hsien Wang, Zhifei Zhang, He Zhang, Zhe Lin, Yingcong Chen",2025,Computer Vision and Pattern Recognition,,https://www.semanticscholar.org/paper/0b1980c6e3f35a37d94f39830ddd020762dcb4f1
Towards a Multimodal Analysis of da Rimini's Dollspace,Maya Zalbidea,2011,,,https://www.semanticscholar.org/paper/264fd541287ceafe31e930e60d8e9fc8f2970e2d
Twin-GAN - Unpaired Cross-Domain Image Translation with Weight-Sharing GANs,Jerry Li,2018,arXiv.org,,https://www.semanticscholar.org/paper/4ab2b6ac74bc2f48c4e1fbf6156ec5f44c3b0654
Twin-GAN ‚Äì Unpaired Cross-Domain Image Translation with Weight-Sharing GANs,,,,,
Information for Contributors,,1980,,,https://www.semanticscholar.org/paper/023d07b7a7c94e727f778d4f5772796ff92917a8
Two-Stage Sketch Colorization With Color Parsing,,,,,
Two-Step Training: Adjustable Sketch Colourization via Reference Image and Text Tag,,,,,
The Application of Semisupervised Attentional Generative Adversarial Networks in Desert Seismic Data Denoising,"Yue Li, X. Luo, N. Wu, Xintong Dong",2022,IEEE Geoscience and Remote Sensing Letters,,https://www.semanticscholar.org/paper/001f46bd4b7305d1bd388cde39d463b1dcbe5540
Unaligned Image-to-Image Translation by Learning to Reweight,,,,,
Unconstrained Text Detection in Manga: a New Dataset and Baseline,,,,,
Universal Face Restoration With Memorized Modulation,,,,,
Semi-paired Image-to-Image Translation using Neighbor-based Generative Adversarial Networks,"Le Xu, Weiling Cai, Honghan Zhou",2021,IEEE International Joint Conference on Neural Network,,https://www.semanticscholar.org/paper/00a9a8689ced36085c9a3447e8cb050e398df6fe
Contrastive Learning and Cycle Consistency-Based Transductive Transfer Learning for Target Annotation,"S. Sami, M. Hasan, Nasser M. Nasrabadi, Raghuveer Rao",2024,IEEE Transactions on Aerospace and Electronic Systems,,https://www.semanticscholar.org/paper/39b05dee119b20936b3e2a589f6577f2ef347f17
Unpaired Sketch-to-Line Translation via Synthesis of Sketches,"Gayoung Lee, Dohyun Kim, Y. Yoo, Dongyoon Han, Jung-Woo Ha, Jaehyuk Chang",2019,SIGGRAPH Asia Technical Briefs,,https://www.semanticscholar.org/paper/f1b1e792d8b498a7bcf95162785c44b20f90b2ba
Do Not Escape From the Manifold: Discovering the Local Coordinates on the Latent Space of GANs,"Jaewoong Choi, Changyeon Yoon, Junho Lee, J. Park, Geonho Hwang, Myung-joo Kang",2021,International Conference on Learning Representations,,https://www.semanticscholar.org/paper/1e2770f58ba8b307d3048a4471cc42c489614484
Unsupervised Discovery of Interpretable Directions in the GAN Latent Space,,,,,
Unsupervised Image-to-Image Translation via Pre-trained StyleGAN2 Network,,,,,
Learning and recognition by a dynamical system with a plastic velocity field,Daniel T. Gascoyne,2015,,,https://www.semanticscholar.org/paper/1f95433b65dcace69cf60f094a8069aa145eac5c
Unsupervised Manga Character Re-identification via Face-body and Spatial-temporal Associated Clustering,"Zhimin Zhang, Zheng Wang, Wei Hu",2022,arXiv.org,,https://www.semanticscholar.org/paper/37a4f69d140af857aae1e2c6b58d9f0b4f7c3705
User Guided Digital Artwork Colorization,,,,,
User-Guided Deep Anime Line Art Colorization with Conditional Adversarial Networks,,,,,
User-Guided Line Art Flat Filling with Split Filling Mechanism,,,,,
Using Comics to Introduce and Reinforce Programming Concepts in CS1,"Sangho Suh, Celine Latulipe, Ken Jen Lee, Bernadette Cheng, E. Law",2021,Technical Symposium on Computer Science Education,,https://www.semanticscholar.org/paper/70421c0ffb7f164b19a9606b98523b69604fd005
Supplementary for “V2C: Visual Voice Cloning”,"Qi Chen, Mingkui Tan, Yuankai Qi, Jiaqiu Zhou, Yuanqing Li, Qi Wu",2022,,,https://www.semanticscholar.org/paper/38c2f5ea9b90eec7e312c3e0fe15ea4c6421e95f
Video2Music: Suitable Music Generation from Videos using an Affective Multimodal Transformer model,"Jaeyong Kang, Soujanya Poria, Dorien Herremans",2023,Expert systems with applications,,https://www.semanticscholar.org/paper/5045d5160ab962861a9f22b150fa16940c331faf
VideoDirectorGPT: Consistent Multi-scene Video Generation via LLM-Guided Planning,,,,,
VidMuse: A Simple Video-to-Music Generation Framework with Long-Short-Term Modeling,,,,,
Visual adaptation in translated comics,,,,,
Crafting Expressive Faces: A Comparative Exploration of Facial Animation Techniques in VToonify and AnimeGan,"Prof. Kiran Bode, Mr. Kuldeep Borkar, Ms. Vaishnavi Sonwane, Mr. Amar Mandale, Mr. Atharva Daware",2023,International Journal for Research in Applied Science and Engineering Technology,,https://www.semanticscholar.org/paper/2f13ae4312285466d3eaaa6e02301c062262d0e8
What do We Expect from Comic Panel Extraction?,"Nhu-Van Nguyen, Christophe Rigaud, J. Burie",2019,2019 International Conference on Document Analysis and Recognition Workshops (ICDARW),,https://www.semanticscholar.org/paper/b78a0494a217c5412f1fd3b24f92ab40da3fbcf7
Zero-Shot Object Detection with Textual Descriptions,,,,,
