title,authors,year,venue,doi,url
Hair Shading Style Transfer for Manga with cGAN,"M. Aizawa, R. Orihara, Y. Sei, Yasuyuki Tahara, Akihiko Ohsuga",2020,International Conference on Agents and Artificial Intelligence,,https://www.semanticscholar.org/paper/8d694b0bc38ab54ef61cebf7a4e71e014bfd4068
SV3D: Novel Multi-view Synthesis and 3D Generation from a Single Image using Latent Video Diffusion,"Vikram S. Voleti, Chun-Han Yao, Mark Boss, Adam Letts, David Pankratz, Dmitry Tochilkin, Christian Laforte, Robin Rombach, Varun Jampani",2024,European Conference on Computer Vision,,https://www.semanticscholar.org/paper/03e2cfa44b64489fb98f09dfbd940043fbef90ad
HistoGAN: Controlling Colors of GAN-Generated and Real Images via Color Histograms,,,,,
How to train your conditional GAN: An approach using geometrically structured latent manifolds,"Sameera Ramasinghe, M. Farazi, Salman Hameed Khan, Nick Barnes, Stepehn Gould",2020,arXiv.org,,https://www.semanticscholar.org/paper/42c2b76352d3a97c0feef88e37f224527e5c5541
HRInversion: High-Resolution GAN Inversion for Cross-Domain Image Synthesis,"Peng Zhou, Lingxi Xie, Bingbing Ni, Lin Liu, Qi Tian",2023,IEEE transactions on circuits and systems for video technology (Print),,https://www.semanticscholar.org/paper/8a93d21c111e9aa78f96764b491c6c0659720829
Human-Art: A Versatile Human-Centric Dataset Bridging Natural and Artificial Scenes,"Xu Ju, Ailing Zeng, Jianan Wang, Qian Xu, Lei Zhang",2023,Computer Vision and Pattern Recognition,,https://www.semanticscholar.org/paper/467b839cb8a2475477ca004df94b797d967ad057
Hyprogan: Breaking the Dimensional wall From Human to Anime,"Yinpeng Chen, Jiale Zhang, Z. Cao, Hao Lu, Weicai Zhong",2022,International Conference on Information Photonics,,https://www.semanticscholar.org/paper/fbbd2392c0a80588a1fc10171b4930350a2c065e
Identity-Aware Semi-Supervised Learning for Comic Character Re-Identification,,,,,
A Remote-Sensing Method to Estimate Bulk Refractive Index of Suspended Particles from GOCI Satellite Measurements over Bohai Sea and Yellow Sea,"D. Sun, Zunbin Ling, Shengqiang Wang, Z. Qiu, Yu Huan, Z. Mao, Yijun He",2019,Applied Sciences,,https://www.semanticscholar.org/paper/023915786a039410d2836f96fce18aa9a1d65c69
Deep Illumination: Approximating Dynamic Global Illumination with Generative Adversarial Network,"M. M. Thomas, A. Forbes",2017,arXiv.org,,https://www.semanticscholar.org/paper/00424e3aed0c6bc392133d027025c7401ce6ab9f
Attribute Consistency Guided Generative Adversarial Networks for Unsupervised Image-to-Image Translation,"Feng-Lin Liu, Li Yao",2022,,,https://www.semanticscholar.org/paper/07748a420c810cbf54dd32c50df821f12582ddd0
Improving the Perceptual Quality of 2D Animation Interpolation,"Shuhong Chen, Matthias Zwicker",2021,European Conference on Computer Vision,,https://www.semanticscholar.org/paper/1831959445c2e995b9fe79dfa6386de6c58138cf
Ink-and-Ray: Bas-Relief Meshes for Adding Global Illumination Effects to Hand-Drawn Characters,,,,,
Intelligent Grimm - Open-ended Visual Storytelling via Latent Diffusion Models,"Chang Liu, Haoning Wu, Yujie Zhong, Xiaoyu Zhang, Weidi Xie",2023,Computer Vision and Pattern Recognition,,https://www.semanticscholar.org/paper/e8753374e402cd756dcfec9bc74a34f8a5047f80
Interactive Cartoonization with Controllable Perceptual Factors,"Namhyuk Ahn, Patrick Kwon, Jihye Back, Kibeom Hong, Seungkwon Kim",2022,Computer Vision and Pattern Recognition,,https://www.semanticscholar.org/paper/04e399a661e1f3ce16f26f5622aaf05eace2ca2f
Interactive Data Comics,,,,,
Interactive Manga Colorization with Fast Flat Coloring,"Delong Ouyang, Ryosuke Furuta, Yugo Shimizu, Y. Taniguchi, Ryota Hinami, Shonosuke Ishiwatari",2021,SIGGRAPH ASIA Posters,,https://www.semanticscholar.org/paper/1e12cef368286175ac98a378a13bc40f8b79432c
Supplementary Materials for Paper “InternVL: Scaling up Vision Foundation Models and Aligning for Generic Visual-Linguistic Tasks”,,,,,https://www.semanticscholar.org/paper/8692a8ac9cb05ddde764db85b40cb062c1a8a6c5
Intrinsic Image Harmonization,,,,,
Joint Geometric-Semantic Driven Character Line Drawing Generation,,,,,
Joint Stroke Tracing and Correspondence for 2D Animation,,,,,
KidsGUARD: Fine Grained Approach for Child Unsafe Video Representation and Detection,,,,,
L2M-GAN: Learning to Manipulate Latent Space Semantics for Facial Attribute Editing,"Guoxing Yang, Nanyi Fei, Mingyu Ding, Guangzhen Liu, Zhiwu Lu, T. Xiang",2021,Computer Vision and Pattern Recognition,,https://www.semanticscholar.org/paper/6a156289c7758ff5ce53cdab0931267e59725d7c
Landmark Assisted CycleGAN for Cartoon Face Generation,"Ruizheng Wu, Xiaodong Gu, Xin Tao, Xiaoyong Shen, Yu-Wing Tai, Jiaya Jia",2019,arXiv.org,,https://www.semanticscholar.org/paper/515ec130736879b3a78859b51ed27e316ed75223
Language-Guided Face Animation by Recurrent StyleGAN-based Generator,,,,,
Large Language Models as Manga Translators: A Case Study,,,,,
LayoutGAN: Synthesizing Graphic Layouts With Vector-Wireframe Adversarial Networks,"Jianan Li, Jimei Yang, Aaron Hertzmann, Jianming Zhang, Tingfa Xu",2020,IEEE Transactions on Pattern Analysis and Machine Intelligence,,https://www.semanticscholar.org/paper/0f10d01ebce1f175019d58a52058827ddbc85d98
Consensus Style Centralizing Auto-Encoder for Weak Style Classification,"Shuhui Jiang, Ming Shao, Chengcheng Jia, Y. Fu",2016,AAAI Conference on Artificial Intelligence,,https://www.semanticscholar.org/paper/05d5860c98b935fa6b1cd037dbac2c13b3945876
"Learning from the Past: Meta-Continual Learning withKnowledge Embedding for Jointly Sketch, Cartoon, andCaricature Face Recognition",,,,,
Learning Inclusion Matching for Animation Paint Bucket Colorization,"Yu Dai, Shangchen Zhou, Qinyue Li, Chongyi Li, Chen Change Loy",2024,Computer Vision and Pattern Recognition,,https://www.semanticscholar.org/paper/3ae8aab20ce7187a2cfeebfcd43ed81b00f7f8a9
Learning Inclusion Matching for Animation Paint Bucket Colorization,"Yu Dai, Shangchen Zhou, Qinyue Li, Chongyi Li, Chen Change Loy",2024,Computer Vision and Pattern Recognition,,https://www.semanticscholar.org/paper/3ae8aab20ce7187a2cfeebfcd43ed81b00f7f8a9
Learning to Cartoonize Using White-Box Cartoon Representations,"Xinrui Wang, Jinze Yu",2020,Computer Vision and Pattern Recognition,,https://www.semanticscholar.org/paper/0269b13ccbe3e3a81213e7ca2b049298d3a154f5
Dubbing Movies via Hierarchical Phoneme Modeling and Acoustic Diffusion Denoising.,"Liang Li, Gaoxiang Cong, Yuankai Qi, Zheng-Jun Zha, Qi Wu, Quan Z. Sheng, Qingming Huang, Ming-Hsuan Yang",2025,IEEE Transactions on Pattern Analysis and Machine Intelligence,,https://www.semanticscholar.org/paper/48b77db746dd5289890f5e6c8fb229f648492e2e
Learning to Simplify: Fully Convolutional Networks for Rough Sketch Cleanup,,,,,
Line Art Correlation Matching Feature Transfer Network for Automatic Animation Colorization,"Qian Zhang, Bo Wang, W. Wen, Hai Li, Junhui Liu",2020,IEEE Workshop/Winter Conference on Applications of Computer Vision,,https://www.semanticscholar.org/paper/dd84195cce4d629227788641a866beea7213c53c
Line-wise text identification in comic books: A support vector machine-based approach,"S. Pal, J. Burie, U. Pal, J. Ogier",2016,IEEE International Joint Conference on Neural Network,,https://www.semanticscholar.org/paper/86f2e81c908a8b186773e2bc05c4abbe98a415ea
LinkTo-Anime: A 2D Animation Optical Flow Dataset from 3D Model Rendering,"Xiaoyi Feng, Kaifeng Zou, Caichun Cen, Tao Huang, Hui Guo, Zizhou Huang, Yingli Zhao, Mingqing Zhang, Diwei Wang, Yuntao Zou, Dagang Li",2025,arXiv.org,,https://www.semanticscholar.org/paper/134588680a389238dfd00e6c0563fb79a26f259c
LVCD: Reference-based Lineart Video Colorization with Diffusion Models,"Zhitong Huang, Mohan Zhang, Jing Liao",2024,ACM Transactions on Graphics,,https://www.semanticscholar.org/paper/97705d8c14345882683edefc367e830f94b3415e
LVCD: Reference-based Lineart Video Colorization with Diffusion Models,"Zhitong Huang, Mohan Zhang, Jing Liao",2024,ACM Transactions on Graphics,,https://www.semanticscholar.org/paper/97705d8c14345882683edefc367e830f94b3415e
Make-A-Storyboard: A General Framework for Storyboard with Disentangled and Merged Control,,,,,
MakeItTalk: Speaker-Aware Talking Head Animation,"Yang Zhou, Dingzeyu Li, Xintong Han, E. Kalogerakis, Eli Shechtman, J. Echevarria",2020,arXiv.org,,https://www.semanticscholar.org/paper/7a7c4e666e5dd8a489770643b72fd99cf708f7c1
Making Robots Draw A Vivid Portrait In Two Minutes,"Fei Gao, Jingjie Zhu, Zeyuan Yu, Peng Li, Tao Wang",2020,IEEE/RJS International Conference on Intelligent RObots and Systems,,https://www.semanticscholar.org/paper/0522d10bafa639e13a6de7abf6de2d4fefbb13fa
Boundary-aware texture region segmentation from manga,"Xueting Liu, Chengze Li, T. Wong",2017,Computational Visual Media,,https://www.semanticscholar.org/paper/006b69083ae5be0a2cee3bdb50dfdeea7b2ccf40
Manga Rescreening with Interpretable Screentone Representation,"M. Xie, Chengze Li, T. Wong",2023,arXiv.org,,https://www.semanticscholar.org/paper/7a6a87bb04eb663fcb6aaa80c1e3c714334ea40e
Manga Vectorization and Manipulation with Procedural Simple Screentone,"Chih-Yuan Yao, Shih-Hsuan Hung, Guo-Wei Li, I-Yu Chen, Reza Adhitya, Yu-Chi Lai",2017,IEEE Transactions on Visualization and Computer Graphics,,https://www.semanticscholar.org/paper/57c36aea1b9a428e6b07e29d31693c5fa90ceae7
Manga-MMTL: Multimodal Multitask Transfer Learning for Manga Character Analysis,"Nhu-Van Nguyen, Christophe Rigaud, A. Revel, J. Burie",2021,IEEE International Conference on Document Analysis and Recognition,,https://www.semanticscholar.org/paper/d4e68231fa58fc567f237c830408ab3fc3186319
Manga109Dialog: A Large-Scale Dialogue Dataset for Comics Speaker Detection,"Yingxuan Li, K. Aizawa, Yusuke Matsui",2023,IEEE International Conference on Multimedia and Expo,,https://www.semanticscholar.org/paper/0bcd777ae62ead721d31030405b714d1af1b554b
Manga109Dialog: A Large-scale Dialogue Dataset for Comics Speaker Detection,,,,,
Unpaired Photo-to-manga Translation Based on The Methodology of Manga Drawing,"Hao Su, J. Niu, Xuefeng Liu, Qingfeng Li, Jiahe Cui, J. Wan",2020,AAAI Conference on Artificial Intelligence,,https://www.semanticscholar.org/paper/55f45f009bdf4f8ec0bbf5c1c0da6db0e39508da
Mangan: Assisting Colorization Of Manga Characters Concept Art Using Conditional GAN,"Felipe Coelho Silva, Paulo André Lima de Castro, Hélio Ricardo Júnior, E. Marujo",2019,International Conference on Information Photonics,,https://www.semanticscholar.org/paper/2300f3f5d39a3fb647990b767d852b182c1c21f4
MangaNinja: Line Art Colorization with Precise Reference Following,,,,,
MangaUB: A Manga Understanding Benchmark for Large Multimodal Models,,,,,
Mastering Sketching: Adversarial Augmentation for Structured Prediction,,,,,
Method for Automatic E-Comic Scene Frame Extraction for Reading Comic on Mobile Devices,"K. Arai, H. Tolle",2010,2010 Seventh International Conference on Information Technology: New Generations,,https://www.semanticscholar.org/paper/d10db1694aedd2f5c144f3171f61dd844b02f3cc
Method for Real Time Text Extraction of Digital Manga Comic,"K. Arai, H. Tolle",2011,,,https://www.semanticscholar.org/paper/25d1d80cbbfc82d8dcd4e98f03dae24027cc3e0f
MineGAN++: Mining Generative Models for Efficient Knowledge Transfer to Limited Data Domains,,,,,
Modeling Artistic Workflows for Image Generation and Editing,,,,,
One-Shot Learning Meets Depth Diffusion in Multi-Object Videos,Anisha Jain,2024,arXiv.org,,https://www.semanticscholar.org/paper/138b1dbfdb6db6aafe60b8d7484131db12e3542a
MuIT: An End-to-End Multitask Learning Transformer,"Deblina Bhattacharjee, Tong Zhang, S. Süsstrunk, M. Salzmann",2022,Computer Vision and Pattern Recognition,,https://www.semanticscholar.org/paper/4b9b3c538999410c58e229ca15437a693cbb03c5
Multi-CartoonGAN with Conditional Adaptive Instance-Layer Normalization for Conditional Artistic Face Translation,"Rina Komatsu, T. Gonsalves",2022,Applied Informatics,,https://www.semanticscholar.org/paper/41818f2e07078e1399182d50cf12537d121e2e43
Multi-modal Segment Assemblage Network for Ad Video Editing with Importance-Coherence Reward,"Yunlong Tang, Siting Xu, Teng Wang, Qin Lin, Qinglin Lu, Feng Zheng",2022,Asian Conference on Computer Vision,,https://www.semanticscholar.org/paper/be5975f7cca9bbf30665d2539619eee01aebddb9
Multi-Teacher Knowledge Distillation For Text Image Machine Translation,,,,,
Multimodal Transformer for Comics Text-Cloze,"Emanuele Vivoli, Joan Lafuente Baeza, Ernest Valveny Llobet, Dimosthenis Karatzas",2024,IEEE International Conference on Document Analysis and Recognition,,https://www.semanticscholar.org/paper/064bdc53a8458e6ecba0728cf8140f703a1fe819
Queue Detection using Fuzzy-Based Neural Network Model,Daehyon Kim,2003,,,https://www.semanticscholar.org/paper/000602188fb676a922b096b5dfcd6e17d22e7d4c
Object Detection for Comics using Manga109 Annotations,,,,,
ObjectDrop: Bootstrapping Counterfactuals for Photorealistic Object Removal and Insertion,"Daniel Winter, Matan Cohen, Shlomi Fruchter, Y. Pritch, A. Rav-Acha, Yedid Hoshen",2024,European Conference on Computer Vision,,https://www.semanticscholar.org/paper/f56c302f143fc39947c489d0e55f5bc4c786bfab
Occlusion­-Aware Manga Character Re­-identification with Self-Paced Contrastive Learning,"Ci-Yin Zhang, Wei-Ta Chu",2023,ACM Multimedia Asia,,https://www.semanticscholar.org/paper/7a0c9d32ac3ac933e355d705dd2b48f78ea535b1
HiveSurf: Breaking the Classification of Natural Landscapes,"Thomas Nicolai, Florian Resatsch, L. Kirchhoff",2006,,,https://www.semanticscholar.org/paper/0530c008b87c0e6f9e9f00a783b1e35651ef9c69
Optical Flow Based Line Drawing Frame Interpolation Using Distance Transform to Support Inbetweenings,"Rei Narita, Keigo Hirakawa, K. Aizawa",2019,International Conference on Information Photonics,,https://www.semanticscholar.org/paper/43d5ef1d4737a1da4ad3dbacd9c243186913eee0
Overcoming Long-term Catastrophic Forgetting through Adversarial Neural Pruning and Synaptic Consolidation,,,,,
Page Stream Segmentation with Convolutional Neural Nets Combining Textual and Visual Features,"Gregor Wiedemann, Gerhard Heyer",2017,International Conference on Language Resources and Evaluation,,https://www.semanticscholar.org/paper/aa787dd40f3237b38053cb489338857fcb2c59b9
Painting Style-Aware Manga Colorization Based On Generative Adversarial Networks,"Yugo Shimizu, Ryosuke Furuta, Delong Ouyang, Y. Taniguchi, Ryota Hinami, Shonosuke Ishiwatari",2021,International Conference on Information Photonics,,https://www.semanticscholar.org/paper/5e0e1017b18376f04ed3291c69dde461ee60bbb5
PaintsTorch: a User-Guided Anime Line Art Colorization Tool with Double Generator Conditional Adversarial Network,"Yliess Hati, Grégor Jouet, F. Rousseaux, Clément Duhart",2019,European Conference on Visual Media Production,,https://www.semanticscholar.org/paper/4180a603f66f03a3663b967d8a53d267ff4a43e5
PAniC-3D: Stylized Single-view 3D Reconstruction from Portraits of Anime Characters,"Shuhong Chen, Kevin Zhang, Yichun Shi, Heng Wang, Yiheng Zhu, Guoxian Song, Sizhe An, Janus Kristjansson, X. Yang, Matthias Zwicker",2023,Computer Vision and Pattern Recognition,,https://www.semanticscholar.org/paper/e2b8284d0b653b4adac10a16561b14e00ffba6b1
Parsing-Conditioned Anime Translation: A New Dataset and Method – Supplementary Materials –,Zhansheng Li,2023,,,https://www.semanticscholar.org/paper/2bed3cb6736df009bb5922ba0dfeecd3e4c82852
"for ""Personalised CLIP or: how to find your vacation videos""","Bruno Korbar, Andrew Zisserman",,,,https://www.semanticscholar.org/paper/19e8016b016b6fd180b3fb7648275160bc496140
AI-Driven Personalized Multisensory Design of Cultural Heritage: A Case Study of Kunqu Opera,"Tián Céng, Jie Zhou",2025,AHFE International,,https://www.semanticscholar.org/paper/9a5c215a1be16c780043b1bcb121b85fb215a2b9
PHOG Analysis of Self-Similarity in Aesthetic Images,,,,,
Preserve Your Own Correlation: A Noise Prior for Video Diffusion Models,"Songwei Ge, Seungjun Nah, Guilin Liu, Tyler Poon, Andrew Tao, Bryan Catanzaro, David Jacobs, Jia-Bin Huang, Ming-Yu Liu, Y. Balaji",2023,IEEE International Conference on Computer Vision,,https://www.semanticscholar.org/paper/02bc11de9d2f75bad48166098aa6b30fffee4d70
PhysAnimator: Physics-Guided Generative Cartoon Animation,,,,,
PI-REC: Progressive Image Reconstruction Network With Edge and Color Domain,"Sheng You, Ning You, Minxue Pan",2019,arXiv.org,,https://www.semanticscholar.org/paper/d0e6adb5ce85dedcad4014a3b121b79c0933d0ef
Progressive Deep Feature Learning for Manga Character Recognition via Unlabeled Training Data,,,,,
Advancing Facial Stylization through Semantic Preservation Constraint and Pseudo-Paired Supervision,"Zhanyi Lu, Yue Zhou",2025,arXiv.org,,https://www.semanticscholar.org/paper/fb4252528f2837cd83ef27c19b492d74869591c2
RAG: Facial Attribute Editing by Learning Residual Attributes,"Honglun Zhang, Wenqing Chen, Jidong Tian, Hao He, Yaohui Jin",2019,IEEE Access,,https://www.semanticscholar.org/paper/a7c531c4a38721516c6c4c155ee2234e0a3656a1
MARVEL: Raster Manga Vectorization via Primitive-wise Deep Reinforcement Learning,"H. Su, Jianwei Niu, Xuefeng Liu, Jiahe Cui, Ji Wan",2021,,,https://www.semanticscholar.org/paper/69f992a107c5cef606e67e84ded07fa372f7d2fb
Re:Draw -- Context Aware Translation as a Controllable Method for Artistic Production,,,,,
Real-time data-driven interactive rough sketch inking,"E. Simo-Serra, S. Iizuka, H. Ishikawa",2018,ACM Transactions on Graphics,,https://www.semanticscholar.org/paper/4fdb4c238c30e3cf463960c88b89635415435711
Reference-based Image Composition with Sketch via Structure-aware Diffusion Model,"Kangyeol Kim, S. Park, Junsoo Lee, J. Choo",2023,arXiv.org,,https://www.semanticscholar.org/paper/7397eb511e866e31c49ae53e4949780f3e5cab66
Relation Analysis between Speech Balloon Shapes and their Serif Descriptions in Comic,"Hideki Tanaka, Ryosuke Yamanishi, Jun-ichi Fukumoto",2015,2015 IIAI 4th International Congress on Advanced Applied Informatics,,https://www.semanticscholar.org/paper/09782a95a14bb22c4d58ada071c485596b1ec617
RPGAN: GANs Interpretability via Random Routing,"A. Voynov, Artem Babenko",2019,arXiv.org,,https://www.semanticscholar.org/paper/19dd6f437cb023e192fa51d25a2205ff1a4e59a8
Sakuga-42M Dataset: Scaling Up Cartoon Research ,,,,,
Scalable Comic-Like Video Summaries and Layout Disturbance,"Luis Herranz, J. Calic, J. Sanchez, M. Mrak",2012,IEEE transactions on multimedia,,https://www.semanticscholar.org/paper/4ef315e86f45e8037fac7c5bf958dd292e4fed3b
Scaling Concept With Text-Guided Diffusion Models,,,,,
Seamless Manga Inpainting with Semantics Awareness,,,,,
Seg2pix: Few Shot Training Line Art Colorization with Segmented Image Data,,,,,
Self-supervised Enhancement of Latent Discovery in GANs,"Silpa Vadakkeeveetil Sreelatha, Adarsh Kappiyath, S. Sumitra",2021,AAAI Conference on Artificial Intelligence,,https://www.semanticscholar.org/paper/5d220f0fcfdb2c8f74996dfc0adeb27fdce453d5
Semantic Example Guided Image-to-Image Translation,,,,,
Semi-Automatic Colorization Pipeline for Anime Characters and its Evaluation in Production,,,,,
Semi-automatic Manga Colorization Using Conditional Adversarial Networks,,,,,
Similar Manga Retrieval Using Visual Vocabulary Based on Regions of Interest,"Weihan Sun, K. Kise",2011,IEEE International Conference on Document Analysis and Recognition,,https://www.semanticscholar.org/paper/f27ccd19c7fc446d6a7139238c90809e551226c8
Skeleton-Driven Inbetweening of Bitmap Character Drawings,,,,,
Sketch-A-Shape: Zero-Shot Sketch-to-3D Shape Generation,"Aditya Sanghi, P. Jayaraman, Arianna Rampini, J. Lambourne, Hooman Shayani, Evan Atherton, Saeid Asgari Taghanaki",2023,arXiv.org,,https://www.semanticscholar.org/paper/1b610296563ef5ce6de78e096d9bcc52543607d6
Sketch-based Anime Hairstyle Editing with Generative Inpainting,,,,,
Sketch-Based Manga Retrieval Using Deep Features,,,,,
Sketch-Guided Scene Image Generation,,,,,
Sketch2Anim: Towards Transferring Sketch Storyboards into 3D Animation,"Lei Zhong, Chuan Guo, Yiming Xie, Jiawei Wang, Changjian Li",2025,ACM Transactions on Graphics,,https://www.semanticscholar.org/paper/9c0973468e3be4783225840253952fe9c3dd0194
SketchColour: Channel Concat Guided DiT-based Sketch-to-Colour Pipeline for 2D Animation,,,,,
SmartShadow: Artistic Shadow Drawing Tool for Line Drawings,"Lvmin Zhang, Jinyue Jiang, Yi Ji, Chunping Liu",2021,IEEE International Conference on Computer Vision,,https://www.semanticscholar.org/paper/78633ef6f2f073942f255b17dad371226da8c668
Spatially Controllable Image Synthesis with Internal Representation Collaging,"Ryohei Suzuki, Masanori Koyama, Takeru Miyato, Taizan Yonetsuji, Huachun Zhu",2018,,,https://www.semanticscholar.org/paper/fe6b20332d37c50722aee0c6133df6c70826d27f
Sprite-from-Sprite: Cartoon Animation Decomposition with Self-supervised Sprite Estimation,,,,,
SSH: A Self-Supervised Framework for Image Harmonization,,,,,
StarGAN Based Facial Expression Transfer for Anime Characters,"Majid Mobini, F. Ghaderi",2020,International Computer Society of Iran Computer Conference,,https://www.semanticscholar.org/paper/540f0a5ff70013eaf90189879bdd1916226ee72b
Story Pattern Analysis Based on Scene Order Information in Four-Scene Comics,"Miki Ueno, H. Isahara",2017,IEEE International Conference on Document Analysis and Recognition,,https://www.semanticscholar.org/paper/42fdc21ffa22ef868575cd1ca56179e503baa103
StyleDubber: Towards Multi-Scale Style Learning for Movie Dubbing,"Gaoxiang Cong, Yuankai Qi, Liang Li, Amin Beheshti, Zhedong Zhang, A. Hengel, Ming-Hsuan Yang, Chenggang Yan, Qingming Huang",2024,Annual Meeting of the Association for Computational Linguistics,,https://www.semanticscholar.org/paper/47565e10d98c9a6a9377565f732b3f949ca73d1f
StyleGAN-NADA: CLIP-Guided Domain Adaptation of Image Generators,,,,,
StyleGANEX: StyleGAN-Based Manipulation Beyond Cropped Aligned Faces,"Shuai Yang, Liming Jiang, Ziwei Liu, Chen Change Loy",2023,IEEE International Conference on Computer Vision,,https://www.semanticscholar.org/paper/06aa2aa2a29f25437545478e7361744aa35a0419
Imagination and Reality: Landscape and the Folk Culture of Joseon Dynasty Korea,M. Finley,2015,,,https://www.semanticscholar.org/paper/333331a2af976ed2adccda84b3a1a200112a60c7
Surrogate Gradient Field for Latent Space Manipulation,"Minjun Li, Yanghua Jin, Huachun Zhu",2021,Computer Vision and Pattern Recognition,,https://www.semanticscholar.org/paper/5f4c8a26d30b9a6a078c3f7433477f1c85cfb555
Synthesis of Screentone Patterns of Manga Characters,,,,,
"From animals to animats 11 : 11th International Conference on Simulation of Adaptive Behavior, SAB 2010, Paris - Clos Lucé, France, August 25-28, 2010 : proceedings",St'ephane Doncieux,2010,,,https://www.semanticscholar.org/paper/4a26ee5fbc29116188b3b91af53323829f79afc2
"Text Detection in Manga by Deep Region Proposal, Classification, and Regression","W. Chu, Chih-Chi Yu",2018,Visual Communications and Image Processing,,https://www.semanticscholar.org/paper/f5a1eba14297ae3ccb10e1a6df8fb692f2175a9b
TexToons: practical texture mapping for hand-drawn cartoon animations,"D. Sýkora, M. Ben-Chen, Martin Čadík, B. Whited, Maryann Simmons",2011,International Symposium on Non-Photorealistic Animation and Rendering,,https://www.semanticscholar.org/paper/18bc297b02f866b7cdb87ffd303401019698592c
The Amazing Mysteries of the Gutter: Drawing Inferences Between Panels in Comic Book Narratives,"Mohit Iyyer, Varun Manjunatha, Anupam Guha, Yogarshi Vyas, Jordan L. Boyd-Graber, Hal Daumé, L. Davis",2016,Computer Vision and Pattern Recognition,,https://www.semanticscholar.org/paper/bf63276c90a803fe0d069ce0a3a4a8236e756363
The Future of Graphic Novel Translation: Fully Automated Systems,"Sandeep Singh, Kang Dept, of, G. Kaur, Sanjay Singla",2024,2024 International Conference on Knowledge Engineering and Communication Systems (ICKECS),,https://www.semanticscholar.org/paper/6f3d405aa672397a892f02e020cc766f427e376b
The Visual Language Research Corpus (VLRC) Project,,,,,
Thin-Plate Spline-based Interpolation for Animation Line Inbetweening,,,,,
Toon3D: Seeing Cartoons from a New Perspective,,,,,
Toward cross-domain object detection in artwork images using improved YoloV5 and XGBoosting,"Tasweer Ahmad, Maximilian Schich",2023,IET Image Processing,,https://www.semanticscholar.org/paper/429f73f346826e7c483a382365a5e4fb6fa75c78
Towards Content-Aware Pixel-Wise Comic Panel Segmentation,"Hikaru Ikuta, Runtian Yu, Yusuke Matsui, K. Aizawa",2022,ICPR Workshops,,https://www.semanticscholar.org/paper/dd678dcf6c039c2bfa9911a3c825413d37a507a0
Towards Diverse Anime Face Generation: Active Label Completion and Style Feature Network,,,,,
Towards Fully Automated Manga Translation,"Ryota Hinami, Shonosuke Ishiwatari, K. Yasuda, Yusuke Matsui",2020,AAAI Conference on Artificial Intelligence,,https://www.semanticscholar.org/paper/a8302a61f49bbf1e702d417c4122dfbc729a4985
"Image analysis and recognition : International Conference, ICIAR 2004, Porto, Portugal, September 29 - October 1, 2004 : proceedings","A. Campilho, M. Kamel",2004,,,https://www.semanticscholar.org/paper/18c95e001f1e6673e651c275c509995f0967b6ba
"Diagrammatic representation and inference : 5th international conference, Diagrams 2008, Herrsching, Germany, September 19-21, 2008 : proceedings","Gem Stapleton, J. Howse, John Lee",2008,,,https://www.semanticscholar.org/paper/30b4bdc3e7d9bb8bd4a27fcadccfe150735916d6
Transfer Learning for Pose Estimation of Illustrated Characters,,,,,
Translation of Illustration Artist Style Using Sailormoonredraw Data,"Keita Awane, Daichi Horita, Hikaru Ikuta, Yusuke Matsui, K. Aizawa, Naohiro Yanase",2022,International Conference on Information Photonics,,https://www.semanticscholar.org/paper/a0128f140b9adcf0e6106609908b80415fe5247b
